<?xml version="1.0" encoding="UTF-8"?>
<salud xmlns:xsi="http://www.w3.org/2001/XMLSchema-instance"
 xsi:noNamespaceSchemaLocation="pruebas.xsd">
    <servicios>
        <!--FISIOTERAPIA-->
        <fisioterapia> 
            <precio>
                <precio_sesion>35€/h</precio_sesion>
                <bono5>160€</bono5>
                <bono10>300€</bono10>
            </precio>
            <dias>
                <dia>lunes</dia>
                <dia>martes</dia>
                <dia>miercoles</dia>
                <dia>jueves</dia>
                <dia>viernes</dia>
            </dias>
            <horas>
                <hora>9:00 - 13:00 </hora>
                <hora>15:00 - 19: 00 </hora>
            </horas>
            <reserva>previa</reserva>
            <empleados>
                <empleado>Chus</empleado>
                <empleado>Marga</empleado>
                <empleado>Silvia</empleado>
            </empleados>
        </fisioterapia>
        <!--PODOLOGIA-->
        <podologia>
            <precio>
                <precio_sesion>25€/h</precio_sesion>
                <bono5>100€</bono5>
                <bono10>190€</bono10>
            </precio>
            <dias>
                <dia>lunes</dia>
                <dia>martes</dia>
                <dia>miercoles</dia>
                <dia>jueves</dia>
                <dia>viernes</dia>
            </dias>
            <horas>
                <hora>9:00 - 13:00 </hora>
                <hora>15:00 - 19: 00 </hora>
            </horas>
            <reserva>previa</reserva>
            <empleados>
                <empleado>Joana</empleado>
            </empleados>
        </podologia>
        <!--PSICOLOGIA-->
        <psicologia>
            <precio>
                <precio_sesion>50€/h</precio_sesion>
                <bono5>220€</bono5>
                <bono10>400€</bono10>
            </precio>
            <dias>
                <dia>lunes</dia>
                <dia>martes</dia>
                <dia>miercoles</dia>
                <dia>jueves</dia>
                <dia>viernes</dia>
            </dias>
            <horas>
                <hora>9:00 - 13:00 </hora>
                <hora>15:00 - 19: 00 </hora>
            </horas>
            <reserva>previa</reserva>
            <empleados>
              <empleado>Aina</empleado>  
            </empleados>        
        </psicologia>
        <!--YOGA-->
        <yoga>
            <precio_mes>25€/mes</precio_mes>
            <plazas>20 personas</plazas>
            <dias>
                <dia>lunes</dia>
                <dia>miercoles</dia>
                <dia>viernes</dia>
            </dias>
            <horas>
                <hora>11:00 - 12:30</hora>
                <hora>17:00 - 18:30</hora>
            </horas>
            <empleados>
                <empleado>Biel</empleado>
                <empleado>Alex</empleado>
            </empleados>
        </yoga>
        <!--PILATES-->
        <pilates>
            <precio>30€/mes</precio>
            <plazas>25 personas</plazas>
            <dias>
                <dia>martes</dia>
                <dia>jueves</dia>
                <dia>viernes</dia>
            </dias>
            <horas>
                <hora>10:00 - 11:30</hora>
                <hora>16:00 - 17:30</hora>
            </horas>
            <empleado>Tolo</empleado>
        </pilates>
        <!--MEDITACION-->
        <meditacion>
            <precio>35€/mes</precio>
            <plazas>10 personas</plazas>
            <dias>
                <dia>lunes</dia>
                <dia>martes</dia>
                <dia>miercoles</dia>
                <dia>jueves</dia>
                <dia>viernes</dia>
            </dias>
            <horas>
                <hora>10:00 - 11:00</hora>
                <hora>19:00 - 20:00</hora>
            </horas>
            <empleados>
                <empleado>Biel</empleado>
                <empleado>Alex</empleado>
            </empleados>
        </meditacion>
    </servicios>
</salud>
  
